{
  "schema_version": "productionWQ-result.v1",
  "generated_at": "2026-03-24T19:51:11+08:00",
  "racedate": "25-03-2026",
  "venue": "HV",
  "source": {
    "pipeline": "production",
    "config": "prod/HKJC_PROD_WQ.json",
    "code_ref": {
      "git_commit": "bb7f92e",
      "script": "hkjc_prod_run_meeting_racecard_graphql.py"
    }
  },
  "models": {
    "W": {
      "name": "GoldenWinBet",
      "threshold": 0.2,
      "alpha": 1.0,
      "beta": 0.0,
      "artifact_paths": {
        "bundle": "models/OVERLAY_RESIDUAL_LGBM_v1_PROD_22bets_thr0p2.pkl"
      }
    },
    "Q": {
      "name": "GoldenQbet",
      "strategy": "2-combo Q",
      "artifact_paths": {
        "bundle": "models/Q_RANKER_v7_PROD_FEB22_111ROI"
      }
    }
  },
  "races": [
    {
      "race_no": 1,
      "distance_m": 2200,
      "surface": "turf",
      "field_size": 12,
      "W": {
        "top1": {
          "horse_no": 7,
          "cur_win_odds": 4.1,
          "p_mkt_win": 0.19818693090163186,
          "score_win": -1.3501543033831318,
          "overlay": 0.04751051561157586,
          "passes_threshold": false
        },
        "top2": null
      },
      "Q": {
        "anchor_horse_no": 7,
        "partners": [
          4,
          6
        ],
        "pairs": [
          "7-4",
          "7-6"
        ]
      },
      "ranked_runners_top6": [
        {
          "rank": 1,
          "horse_no": 7,
          "horse_code": "J331",
          "horse_name_zh": "幸運同行",
          "cur_win_odds": 4.1,
          "p_mkt_win": 0.19818693090163186,
          "score_win": -1.3501543033831318,
          "overlay": 0.04751051561157586,
          "q_ranker_score": -1.847583015812586,
          "q_rank_field": 7
        },
        {
          "rank": 2,
          "horse_no": 4,
          "horse_code": "H168",
          "horse_name_zh": "夢照發",
          "cur_win_odds": 5.8,
          "p_mkt_win": 0.14009765805115357,
          "score_win": -1.774886099669917,
          "overlay": 0.03959299031885882,
          "q_ranker_score": -0.23801418409457703,
          "q_rank_field": 1
        },
        {
          "rank": 3,
          "horse_no": 9,
          "horse_code": "H293",
          "horse_name_zh": "開心三多",
          "cur_win_odds": 7.3,
          "p_mkt_win": 0.11131046804064254,
          "score_win": -2.0548551291136277,
          "overlay": 0.02256950617724247,
          "q_ranker_score": -1.3210576064320425,
          "q_rank_field": 3
        },
        {
          "rank": 4,
          "horse_no": 2,
          "horse_code": "E496",
          "horse_name_zh": "管之友",
          "cur_win_odds": 8.4,
          "p_mkt_win": 0.0967340972257965,
          "score_win": -2.158135990973927,
          "overlay": 0.07591503642961707,
          "q_ranker_score": -2.5598698102606376,
          "q_rank_field": 9
        },
        {
          "rank": 5,
          "horse_no": 5,
          "horse_code": "J541",
          "horse_name_zh": "古惑大師",
          "cur_win_odds": 10,
          "p_mkt_win": 0.08125664166966906,
          "score_win": -2.4406568039550827,
          "overlay": -0.015262543978091753,
          "q_ranker_score": -1.5219311969210694,
          "q_rank_field": 6
        },
        {
          "rank": 6,
          "horse_no": 1,
          "horse_code": "H213",
          "horse_name_zh": "富喜來",
          "cur_win_odds": 11,
          "p_mkt_win": 0.07386967424515369,
          "score_win": -2.5041650941197493,
          "overlay": 0.024547489488007196,
          "q_ranker_score": -1.5088027119098704,
          "q_rank_field": 5
        }
      ]
    },
    {
      "race_no": 2,
      "distance_m": 1650,
      "surface": "turf",
      "field_size": 12,
      "W": {
        "top1": {
          "horse_no": 3,
          "cur_win_odds": 4.6,
          "p_mkt_win": 0.1768543774937818,
          "score_win": -1.4269539860918536,
          "overlay": 0.11085247208460519,
          "passes_threshold": false
        },
        "top2": null
      },
      "Q": {
        "anchor_horse_no": 3,
        "partners": [
          9,
          1
        ],
        "pairs": [
          "3-9",
          "3-1"
        ]
      },
      "ranked_runners_top6": [
        {
          "rank": 1,
          "horse_no": 3,
          "horse_code": "K406",
          "horse_name_zh": "知道穩勝",
          "cur_win_odds": 4.6,
          "p_mkt_win": 0.1768543774937818,
          "score_win": -1.4269539860918536,
          "overlay": 0.11085247208460519,
          "q_ranker_score": -1.3313158525521351,
          "q_rank_field": 3
        },
        {
          "rank": 2,
          "horse_no": 9,
          "horse_code": "J098",
          "horse_name_zh": "先到先得",
          "cur_win_odds": 5.6,
          "p_mkt_win": 0.14527323865560646,
          "score_win": -1.7314710846903616,
          "overlay": 0.04069438211654405,
          "q_ranker_score": 0.5702751315079168,
          "q_rank_field": 1
        },
        {
          "rank": 3,
          "horse_no": 1,
          "horse_code": "K162",
          "horse_name_zh": "佳登",
          "cur_win_odds": 5.9,
          "p_mkt_win": 0.13788646380871122,
          "score_win": -1.808737570475775,
          "overlay": 0.024218783524907556,
          "q_ranker_score": -0.5053093761026703,
          "q_rank_field": 2
        },
        {
          "rank": 4,
          "horse_no": 12,
          "horse_code": "G292",
          "horse_name_zh": "多利神駒",
          "cur_win_odds": 7.7,
          "p_mkt_win": 0.10565326447680469,
          "score_win": -2.1601452706527584,
          "overlay": -0.024214365891811238,
          "q_ranker_score": -1.8690830382735348,
          "q_rank_field": 5
        },
        {
          "rank": 5,
          "horse_no": 11,
          "horse_code": "J395",
          "horse_name_zh": "至高心得",
          "cur_win_odds": 8,
          "p_mkt_win": 0.10169126705892452,
          "score_win": -2.199096528845244,
          "overlay": -0.020524148766808026,
          "q_ranker_score": -3.1650695755387015,
          "q_rank_field": 9
        },
        {
          "rank": 6,
          "horse_no": 8,
          "horse_code": "L047",
          "horse_name_zh": "準希望",
          "cur_win_odds": 10,
          "p_mkt_win": 0.08135301364713962,
          "score_win": -2.2780707526748407,
          "overlay": 0.14603328944210417,
          "q_ranker_score": -2.1388765753966115,
          "q_rank_field": 6
        }
      ]
    },
    {
      "race_no": 3,
      "distance_m": 1200,
      "surface": "turf",
      "field_size": 12,
      "W": {
        "top1": {
          "horse_no": 6,
          "cur_win_odds": 3.6,
          "p_mkt_win": 0.22587798864804884,
          "score_win": -1.0297482553652755,
          "overlay": 0.2019862629570683,
          "passes_threshold": true
        },
        "top2": null
      },
      "Q": {
        "anchor_horse_no": 6,
        "partners": [
          5,
          7
        ],
        "pairs": [
          "6-5",
          "6-7"
        ]
      },
      "ranked_runners_top6": [
        {
          "rank": 1,
          "horse_no": 6,
          "horse_code": "J362",
          "horse_name_zh": "比特星",
          "cur_win_odds": 3.6,
          "p_mkt_win": 0.22587798864804884,
          "score_win": -1.0297482553652755,
          "overlay": 0.2019862629570683,
          "q_ranker_score": -0.5824762528844365,
          "q_rank_field": 2
        },
        {
          "rank": 2,
          "horse_no": 2,
          "horse_code": "E490",
          "horse_name_zh": "金發盛世",
          "cur_win_odds": 4.3,
          "p_mkt_win": 0.18910715328673855,
          "score_win": -1.3247384367259953,
          "overlay": 0.13108368075690346,
          "q_ranker_score": -1.2818976647044416,
          "q_rank_field": 5
        },
        {
          "rank": 3,
          "horse_no": 5,
          "horse_code": "H459",
          "horse_name_zh": "星運少爵",
          "cur_win_odds": 5.3,
          "p_mkt_win": 0.15342655832697658,
          "score_win": -1.5979694020752733,
          "overlay": 0.11000554979310828,
          "q_ranker_score": -0.5683562133571266,
          "q_rank_field": 1
        },
        {
          "rank": 4,
          "horse_no": 7,
          "horse_code": "K283",
          "horse_name_zh": "可靠大師",
          "cur_win_odds": 9,
          "p_mkt_win": 0.09035119545921952,
          "score_win": -2.1804525193834285,
          "overlay": 0.12890182818623075,
          "q_ranker_score": -0.7330829686180353,
          "q_rank_field": 3
        },
        {
          "rank": 5,
          "horse_no": 8,
          "horse_code": "K553",
          "horse_name_zh": "驕陽雄心",
          "cur_win_odds": 12,
          "p_mkt_win": 0.06776339659441465,
          "score_win": -2.480585399118959,
          "overlay": 0.14097907373943905,
          "q_ranker_score": -1.2391551159806924,
          "q_rank_field": 4
        },
        {
          "rank": 6,
          "horse_no": 10,
          "horse_code": "J223",
          "horse_name_zh": "新力驕",
          "cur_win_odds": 14,
          "p_mkt_win": 0.05808291136664112,
          "score_win": -2.680519973768388,
          "overlay": 0.10552578452518933,
          "q_ranker_score": -2.5835236197529023,
          "q_rank_field": 11
        }
      ]
    },
    {
      "race_no": 4,
      "distance_m": 1650,
      "surface": "turf",
      "field_size": 12,
      "W": {
        "top1": {
          "horse_no": 6,
          "cur_win_odds": 5.1,
          "p_mkt_win": 0.1597794100718949,
          "score_win": -1.4995227307060421,
          "overlay": 0.16034755679363935,
          "passes_threshold": false
        },
        "top2": null
      },
      "Q": {
        "anchor_horse_no": 6,
        "partners": [
          4,
          8
        ],
        "pairs": [
          "6-4",
          "6-8"
        ]
      },
      "ranked_runners_top6": [
        {
          "rank": 1,
          "horse_no": 6,
          "horse_code": "K155",
          "horse_name_zh": "爆出美麗",